[
  {
    "id": "char_u6c34",
    "character": "水",
    "unicode": "U+6C34",
    "pinyin": "shuǐ",
    "tone": 3,
    "strokeCount": 4,
    "radical": "水",
    "frequency": 100,
    "source": "opensource-placeholder",
    "sourceLicense": "TO_BE_CONFIRMED",
    "sourceSnapshot": "TO_BE_CONFIRMED"
  }
]
